post_name,Url
How to Care For Your Senior Dog,https://www.petmd.com/dog/general-health/how-to-care-for-senior-dog
"Dog Car Safety: Do You Need a Dog Car Seat, Dog Seat Belt, Barrier or a Carrier?",https://www.petmd.com/dog/care/dog-car-safety-do-you-need-dog-car-seat-dog-seat-belt-barrier-or-carrier
Diving Dogs: Everything You Wanted to Know About Dock Diving,https://www.petmd.com/dog/training/everything-about-dock-diving-dogs
How To Socialize a Puppy and Why It’s So Important,https://www.petmd.com/dog/behavior/how-to-socialize-puppy
"5 Common Shoulder Injuries in Dogs: How To Identify, Treat, and Manage Them",https://www.petmd.com/dog/general-health/common-shoulder-injuries-dogs
10 Ways to Dog-Proof Your Christmas Tree,https://www.petmd.com/dog/ways-to-dog-proof-christmas-tree
Are Hydrangeas Poisonous to Dogs?,https://www.petmd.com/dog/poisons/are-hydrangeas-poisonous-to-dogs
4 Hairless Dog Breeds,https://www.petmd.com/dog/general-health/hairless-dog-breeds
 10 Summer Dog Walking Tips,https://www.petmd.com/dog/general-health/summer-dog-walking-tips
5 Safety Tips for Hunting With a Dog,https://www.petmd.com/dog/general-health/safety-tips-for-hunting-with-dog
How To Leash Train a Dog,https://www.petmd.com/dog/general-health/how-to-leash-train-dog
How Long Do Dogs Live?,https://www.petmd.com/dog/care/how-long-do-dogs-live
How Cold Is Too Cold for Your Dog?,https://www.petmd.com/dog/care/how-cold-too-cold-dog
Why Do Female Dogs Hump?,https://www.petmd.com/dog/behavior/why-do-female-dogs-hump
Dog Pooping in the House: Why It's Happening and What To Do,https://www.petmd.com/dog/behavior/dog-pooping-house-why-and-what-do
 How Often Should I Take My Dog to the Veterinarian?,https://www.petmd.com/dog/general-health/how-often-should-i-take-my-dog-veterinarian
Dog Agility 101,https://www.petmd.com/dog/training/dog-agility-101
Can Dogs Lose Their Voice?,https://www.petmd.com/dog/general-health/can-dogs-lose-their-voice
"Dog Pregnancy, Birth, and Postpartum Care: The Complete Guide",https://www.petmd.com/dog/conditions/reproductive/dog-pregnancy-birth-and-puppy-care-complete-guide
Everything To Know About Safely Traveling With a Puppy,https://www.petmd.com/dog/general-health/traveling-with-puppy
Why Do Dogs Lick You?,https://www.petmd.com/dog/behavior/why-do-dogs-lick-you
7 Pool Safety Tips for Dogs,https://www.petmd.com/dog/general-health/pool-safety-tips-for-dogs
Dangerous Winter Holiday Plants for Pets,https://www.petmd.com/general-health/dangerous-winter-holiday-plants-for-pets
6 Holiday Food Scraps That Are Dangerous for Dogs,https://www.petmd.com/dog/nutrition/holiday-food-scraps-that-are-dangerous-for-dogs
What Does Pet Insurance Cover?,https://www.petmd.com/general-health/what-does-pet-insurance-cover
How Much Does Pet Insurance Cost?,https://www.petmd.com/general-health/how-much-does-pet-insurance-cost
8 Things People Don’t Realize About Being a Veterinarian,https://www.petmd.com/dog/general-health/things-people-dont-realize-about-being-a-vet
How to Hike With Your Dog Safely,https://www.petmd.com/dog/general-health/how-to-hike-with-your-dog-safely
Why Do Dogs Eat Poop?,https://www.petmd.com/dog/behavior/why-do-dogs-eat-poop
Why Do Dogs Wag Their Tails?,https://www.petmd.com/dog/behavior/why-do-dogs-wag-their-tails
How to Puppy-Proof Your House,https://www.petmd.com/dog/general-health/how-to-puppy-proof-your-house
Protecting Pets During Domestic Violence Situations,https://www.petmd.com/general-health/protecting-pets-during-domestic-violence
How Often Should You Bathe Your Dog?,https://www.petmd.com/dog/general-health/how-often-should-you-bathe-your-dog
Puppy and Dog Vaccinations: A Schedule for Every Life Stage,https://www.petmd.com/dog/care/dog-vaccinations-for-every-lifestage
Does Neutering Affect a Dog’s Behavior?,https://www.petmd.com/dog/behavior/dogs-neutering-affect-behavior
How to Travel With Your Dog: The Ultimate Guide,https://www.petmd.com/dog/general-health/how-to-travel-with-dog-ultimate-guide
6 Tips for Keeping Your Dog Safe Around a Christmas Tree,https://www.petmd.com/dog/general-health/tips-for-keeping-dog-safe-around-christmas-tree
How To Introduce a Cat to a Dog,https://www.petmd.com/cat/general-health/how-to-introduce-cat-to-dog
How To Find the Right Vet Near You,https://www.petmd.com/general-health/how-to-find-vet-near-you
Black Fly Bite on Dogs,https://www.petmd.com/dog/general-health/black-fly-bite-dogs
4 Most Common Sleep Disorders in Dogs,https://www.petmd.com/dog/general-health/most-common-sleep-disorders-dogs
Prey Drive in Dogs,https://www.petmd.com/dog/behavior/prey-drive-dog
Why Do Dogs Put Their Paws On People?,https://www.petmd.com/dog/behavior/why-do-dogs-put-their-paws-on-people
22 Holiday Items That Can Harm Your Pets,https://www.petmd.com/general-health/holiday-items-that-can-harm-pets
Do Dogs Have a Sense of Time?,https://www.petmd.com/dog/behavior/do-dogs-have-sense-time
8 Surprising Things Your Dog Can Sense,https://www.petmd.com/dog/behavior/surprising-things-your-dog-can-sense
Introducing PetMD’s Symptom Checker ,https://www.petmd.com/general-health/-introducing-petmd-symptom-checker
6 Things to Know About Pet-Safe Ice Melts,https://www.petmd.com/dog/general-health/things-to-know-about-pet-safe-ice-melts
Wellness Plans for Dogs,https://www.petmd.com/dog/general-health/wellness-plans-dogs
Balanced Dog Training vs. Positive Reinforcement,https://www.petmd.com/dog/training/balanced-dog-training-vs-positive-reinforcement
How Many Hours Does a Dog Sleep in a Day?,https://www.petmd.com/dog/general-health/how-many-hours-does-dog-sleep-day
How To Find Your Dog's Body Condition Score,https://www.petmd.com/dog/nutrition/how-find-your-dogs-body-condition-score
How To Stop a Puppy From Peeing in the House,https://www.petmd.com/dog/behavior/how-keep-new-puppy-peeing-house
How To Stop a Puppy From Biting,https://www.petmd.com/dog/training/puppy-biting
5 Things to Know When Feeding Your Dog Hill’s Prescription Diet ,https://www.petmd.com/dog/nutrition/things-to-know-feeding-dog-hills-diet
5 Reasons Your Dog Won’t Stop Barking,https://www.petmd.com/dog/behavior/5-reasons-your-dog-wont-stop-barking
How to Crate Train a Puppy,https://www.petmd.com/dog/general-health/crate-training-puppies
Dog Calming Products to Help Ease Dog Anxiety,https://www.petmd.com/dog/behavior/dog-calming-products-help-ease-dog-anxiety
6 Must-Have Items for Your Dog’s Spay or Neuter Recovery,https://www.petmd.com/dog/care/create-your-home-kit-neuter-and-spay-recovery-dogs
How to Keep Dog Pee From Ruining Your Lawn,https://www.petmd.com/dog/care/how-keep-dog-pee-ruining-your-lawn
Dog Neuter Recovery: What to Expect,https://www.petmd.com/dog/general-health/dog-neuter-recovery-what-expect
Lumps on Dogs: 4 Ways Veterinarians Diagnose Lumps and Bumps on Dogs,https://www.petmd.com/dog/ways-veterinarians-diagnose-lumps-and-bumps-dogs
What Causes Urinary Incontinence in Dogs and How Do You Treat It?,https://www.petmd.com/dog/general-health/incontinence-senior-dogs-what-do-and-how-help
7 Common Bug Bites on Dogs,https://www.petmd.com/dog/general-health/7-common-bug-bites-dogs
Dog Spay Recovery: What to Expect,https://www.petmd.com/dog/general-health/dog-spay-recovery-what-expect
What Should My Dog's Poop Look Like?,https://www.petmd.com/dog/care/how-should-my-dogs-poop-look
Fecal Tests for Dogs,https://www.petmd.com/dog/general-care/fecal-tests-dogs
How to Clean a Dog's Ears,https://www.petmd.com/dog/general-health/how-clean-dogs-ears
How To Tell If a Dog Is in Pain and What You Can Do To Help,https://www.petmd.com/dog/care/evr_dg_managing_pain_in_dogs
What Should My Dog's Poop Look Like?,https://www.petmd.com/dog/care/how-should-my-dogs-poop-look
How to Keep Your Dog From Chewing and Scratching Everything,https://www.petmd.com/dog/behavior/how-to-stop-dogs-from-chewing-and-scratching-everything
Aggression in Dogs,https://www.petmd.com/dog/behavior/aggression-in-dogs
Why Do Dogs Pant? Is Your Dog Panting Too Much?,https://www.petmd.com/dog/behavior/evr_dg_why_do_dogs_pant
Resource Guarding in Dogs,https://www.petmd.com/dog/behavior/resource-guarding-dogs
Marking in Dogs,https://www.petmd.com/dog/behavior/urine-marking-dogs
Aggression in Dogs,https://www.petmd.com/dog/behavior/aggression-in-dogs
Does Your Dog Have Healthy Gums?,https://www.petmd.com/dog/general-health/does-your-dog-have-healthy-gums
Fear Aggression in Dogs,https://www.petmd.com/dog/behavior/fear-aggression-dogs
Signs of Anxiety in Dogs and Puppies,https://www.petmd.com/dog/behavior/signs-anxiety-dogs-and-puppies
How to Keep Your Dog From Chewing and Scratching Everything,https://www.petmd.com/dog/behavior/how-to-stop-dogs-from-chewing-and-scratching-everything
How to Help a Dog With Separation Anxiety,https://www.petmd.com/dog/training/how-help-dog-separation-anxiety
Does Your Dog Have Healthy Gums?,https://www.petmd.com/dog/general-health/does-your-dog-have-healthy-gums
Pet Wellness Exams: How to Prepare,https://www.petmd.com/general-health/pet-wellness-exams-how-prepare
8 Things to Know About the Tick Life Cycle,https://www.petmd.com/general-health/8-things-to-know-tick-life-cycle
7 Ways to Get Help With Vet Bills,https://www.petmd.com/general-health/7-ways-get-help-vet-bills
Does Pet Insurance Cover Pre-Existing Conditions?,https://www.petmd.com/general-health/does-pet-insurance-cover-pre-existing-conditions
Why Is My Dog So Clingy? ,https://www.petmd.com/dog/behavior/how-manage-clingy-dog-behavior-0
How to Use a Crate for Potty Training an Older Dog,https://www.petmd.com/dog/training/ins-and-outs-potty-training-older-dogs-0
Military Working Dogs: Understanding Canine Post-Traumatic Stress Disorder,https://www.petmd.com/dog/behavior/military-working-dogs-understanding-canine-post-traumatic-stress-disorder
How to Treat Yeast Infections in Dogs,https://www.petmd.com/dog/general-health/10-signs-your-dog-has-yeast-infection
Why You Should Adopt a Pet,https://www.petmd.com/dog/care/evr_multi_5_shelter_pet_adoption_myths
How to Teach Your Dog to Swim,https://www.petmd.com/dog/training/evr_dg_how_to_teach_your_dog_how_to_swim
"What’s the Difference Between Service Dogs, Emotional Support Dogs and Therapy Dogs?",https://www.petmd.com/dog/training/whats-difference-between-service-dogs-emotional-support-dogs-and-therapy-dogs
What to Know: Adopting a Dog with Lyme Disease,https://www.petmd.com/dog/what-know-adopting-dog-lyme-disease
What to Know: Adopting a Tripod Dog,https://www.petmd.com/dog/what-know-adopting-tripod-dog
"How to Keep Small Dogs Healthy, From Puppy to Senior Dog",https://www.petmd.com/dog/general-health/how-keep-small-dogs-healthy-puppy-senior-dog
"How to Keep Small Dogs Healthy, From Puppy to Senior Dog",https://www.petmd.com/dog/general-health/how-keep-small-dogs-healthy-puppy-senior-dog
What to Know: Adopting a Senior Pet,https://www.petmd.com/dog/care/what-to-know-adopting-senior-pet
5 Reasons to Foster a Pet During the Holidays,https://www.petmd.com/dog/care/5-reasons-foster-pet-during-holidays
21 Longest-Living Dog Breeds That'll Be Your Longtime Companion,https://www.petmd.com/dog/care/longest-living-dog-breeds
10 Tips for the First 30 Days After Adopting a Dog,https://www.petmd.com/dog/care/10-tips-first-30-days-after-adopting-dog
Insurance for Dogs,https://www.petmd.com/dog/general-health/insurance-for-dogs
How To Stop a Dog From Digging,https://www.petmd.com/dog/behavior/how-to-stop-dog-digging
How to Check Your Pet’s Stitches After Surgery,https://www.petmd.com/dog/general-health/how-to-check-pet-stitches-after-surgery
How to Start an Age-Appropriate Exercise Plan for Your Senior Dog,https://www.petmd.com/dog/care/how-start-age-appropriate-exercise-plan-your-senior-dog
Pet Adoption: Should You Rename Your Dog or Cat?,https://www.petmd.com/dog/care/pet-adoption-should-you-rename-your-dog-or-cat
The Ultimate Guide to Responsible Pet Adoption,https://www.petmd.com/dog/care/ultimate-guide-responsible-pet-adoption
Why Is My Puppy Crying and Whining and How Can I Help Them?,https://www.petmd.com/dog/behavior/puppy-crying-why-it-happens-and-how-help
Why Is My Puppy Crying and Whining and How Can I Help Them?,https://www.petmd.com/dog/behavior/puppy-crying-why-it-happens-and-how-help
Puppy Insurance 101,https://www.petmd.com/dog/general-health/puppy-insurance-101
Doodle Dogs 101,https://www.petmd.com/dog/care/doodle-dogs-101
How to Keep Large Dogs Healthy at Every Life Stage,https://www.petmd.com/dog/general-health/how-keep-large-dogs-healthy-every-life-stage
What Not to Say to Someone Who Lost a Pet (and What to Say Instead),https://www.petmd.com/what-not-say-someone-who-lost-pet-and-what-say-instead
Pet Memorial and Funeral Ideas,https://www.petmd.com/care/pet-memorials-and-funerals
Pet Memorial and Funeral Ideas,https://www.petmd.com/care/pet-memorials-and-funerals
Do Dogs and Cats Grieve?,https://www.petmd.com/care/do-dogs-and-cats-grieve
Deceased Pet Care: Burial and Cremation Options ,https://www.petmd.com/dog/care/deceased-pet-care-burial-cremation-options
How To Train a Dog With Positive Reinforcement,https://www.petmd.com/dog/behavior/how-to-train-a-dog-with-positive-reinforcement
Leash Reactivity in Dogs,https://www.petmd.com/dog/behavior/leash-reactivity-in-dogs
How Therapy Dogs Can Improve the Emotional Health of Hospital Patients,https://www.petmd.com/dog/care/how-therapy-dogs-can-improve-emotional-health-hospital-patients
How to Get an Emotional Support Animal Registered,https://www.petmd.com/dog/care/emotional-support-pets-explained
Leash Reactivity in Dogs,https://www.petmd.com/dog/behavior/leash-reactivity-in-dogs
Are Dogs’ Mouths Cleaner Than Humans’ Mouths?,https://www.petmd.com/dog/general-health/are-dogs-mouths-cleaner-humans-mouths
Why Do Dogs Lick Everything?,https://www.petmd.com/dog/behavior/why-do-dogs-lick-everything
Why Do Dogs Lift Their Leg to Pee?,https://www.petmd.com/dog/behavior/why-do-dogs-lift-their-leg-pee
Why Does My Dog Follow Me Everywhere?,https://www.petmd.com/dog/behavior/4-reasons-your-dog-follows-you-everywhere
Why Do Dogs Have Whiskers?,https://www.petmd.com/dog/general-health/why-do-dogs-have-whiskers
Is My Dog Happy?,https://www.petmd.com/dog/behavior/is-my-dog-happy
What Do Dogs See When They Watch TV?,https://www.petmd.com/dog/general-health/can-dogs-see-tv
Do Dogs Get Jealous?,https://www.petmd.com/dog/behavior/do-dogs-get-jealous
How Therapy Dogs Can Improve the Emotional Health of Hospital Patients,https://www.petmd.com/dog/care/how-therapy-dogs-can-improve-emotional-health-hospital-patients
Why Do Dogs Twitch in Their Sleep?,https://www.petmd.com/dog/general-health/why-do-dogs-twitch-their-sleep
Is My Dog Happy?,https://www.petmd.com/dog/behavior/is-my-dog-happy
Why Do Dogs Smell Your Crotch?,https://www.petmd.com/dog/behavior/why-do-dog-smell-peoples-crotches
Why Do Dogs Twitch in Their Sleep?,https://www.petmd.com/dog/general-health/why-do-dogs-twitch-their-sleep
5 Quick Tips for Dog Obedience Training,https://www.petmd.com/dog/training/evr_dg_tips_for_basic_obedience_training
8 Extreme Sports for Dogs,https://www.petmd.com/dog/training/8-extreme-sports-dogs
The Best Hiking Gear for Dogs,https://www.petmd.com/dog/general-health/best-hiking-gear-dogs
"Thunderstorm, Thunder and Lightning Safety for Dogs and Cats",https://www.petmd.com/general-health/thunderstorm-and-lightning-safety-pets
Can Benadryl Help With Dog Anxiety?,https://www.petmd.com/dog/behavior/can-benadryl-help-dog-anxiety
What to Know: Adopting a Heartworm-Positive Dog,https://www.petmd.com/dog/what-know-adopting-heartworm-positive-dog
Why Dogs Pee When Excited or Scared,https://www.petmd.com/dog/behavior/why-dogs-pee-when-excited-or-scared
Dog Anxiety Help: How to Calm Down an Anxious Dog,https://www.petmd.com/dog/behavior/evr_dg_how-to-calm-down-an-anxious-dog
What to Know: Adopting a Diabetic Dog,https://www.petmd.com/dog/what-know-adopting-diabetic-dog
Why Dogs Pee When Excited or Scared,https://www.petmd.com/dog/behavior/why-dogs-pee-when-excited-or-scared
What to Know: Adopting a Greyhound Dog,https://www.petmd.com/dog/pet-lover/what-know-if-you-are-considering-adopting-greyhound
Reverse Sneezing in Dogs,https://www.petmd.com/dog/general-health/reverse-sneezing-dogs
6 Dangerous Halloween Candies for Dogs,https://www.petmd.com/emergency/most-dangerous-halloween-candies-dogs
Flea and Tick Prevention and Treatment for Dogs,https://www.petmd.com/dog/general-health/flea-and-tick-prevention-and-treatment-dogs
The Importance of 'Scent Walks' for Dogs,https://www.petmd.com/dog/behavior/importance-scent-walks-dogs
Can Dogs Eat Ice?,https://www.petmd.com/dog/general-health/ice-bad-dogs
How to Build a Homeopathic and Herbal First Aid Kit for Pets,https://www.petmd.com/dog/general-health/how-build-homeopathic-and-herbal-first-aid-kit-pets
10 Pet Safety Tips for the Fourth of July,https://www.petmd.com/general-health/fourth-of-july-pet-safety-tips
Why Do Dogs Chase Their Tail?,https://www.petmd.com/dog/behavior/why-do-dogs-chase-their-tails
How Much Does Dog Teeth Cleaning Cost?,https://www.petmd.com/dog/care/how-much-does-dog-teeth-cleaning-cost
9 Cost-Effective Ways To Keep Your Dog Mentally Stimulated,https://www.petmd.com/dog/general-health/ways-to-keep-dog-mentally-stimulated
9 Cost-Effective Ways To Keep Your Dog Mentally Stimulated,https://www.petmd.com/dog/general-health/ways-to-keep-dog-mentally-stimulated
How Often Should You Walk Your Dog?,https://www.petmd.com/dog/general-health/how-often-should-you-walk-your-dog
Why Do Dogs Howl? 5 Reasons To Understand Why Your Dog Is Howling,https://www.petmd.com/dog/behavior/why-do-dogs-howl
6 Signs Your Dog Isn’t Getting Enough Exercise,https://www.petmd.com/dog/general-health/top-signs-your-dog-is-not-getting-enough-exercise
How to Read a Dog's Body Language,https://www.petmd.com/dog/behavior/how-to-read-dog-body-language
9 Pet Health Myths You Should Stop Believing,https://www.petmd.com/general-health/9-pet-health-myths-you-should-stop-believing
Why Do Dogs Shed?,https://www.petmd.com/dog/care/why-do-dogs-shed
The Responsible Pet Owner's Checklist for Taking Care of a Pet,https://www.petmd.com/dog/care/responsible-pet-owners-checklist-taking-care-pet
How to Make Your Dog’s Crate Feel Like Home,https://www.petmd.com/dog/care/how-make-your-dogs-crate-feel-home
What to Do When Your Puppy Whines in His Crate,https://www.petmd.com/dog/training/what-do-when-your-puppy-whines-his-crate
12 Hurricane Safety Tips for Pets,https://www.petmd.com/dog/care/evr_multi_hurricane_safety_tips
Why Do Dogs Roll on Dead Animals?,https://www.petmd.com/dog/behavior/why-do-dogs-roll-dead-animals
5 Halloween Pet Safety Tips,https://www.petmd.com/dog/seasonal/evr_multi_halloween_safety_tips
8 Safety Considerations for Halloween Pet Costumes,https://www.petmd.com/dog/safety-considerations-halloween-pet-costumes
Why Do Puppies Eat Poop?,https://www.petmd.com/dog/general-health/why-do-puppies-eat-poop
Signs of a Dog Dying of Congestive Heart Failure (CHF),https://www.petmd.com/dog/care/signs-dog-dying-congestive-heart-failure-chf
Why Do Dogs Kick After Pooping?,https://www.petmd.com/dog/behavior/dog-behavior-why-do-dogs-kick-their-feet-after-pooping
Signs a Dog Is Dying,https://www.petmd.com/dog/general-health/signs-dog-dying
Dog Hospice and Palliative Care,https://www.petmd.com/dog/general-health/dog-hospice-and-palliative-care
Do Dogs Know When They Are Dying?,https://www.petmd.com/dog/general-health/do-dogs-know-when-they-are-dying
Making Dogs Throw Up,https://www.petmd.com/dog/poisoning/making-dogs-throw-up
Everything You Need to Know About Dog Dewclaws,https://www.petmd.com/dog/care/5-things-you-need-know-about-dog-dewclaws
How Do Talking Dog Buttons Work?,https://www.petmd.com/dog/behavior/how-do-talking-dog-buttons-work
How to Build a Dog Kennel,https://www.petmd.com/dog/care/evr_dg_building_kennel
Is a Christmas Cactus Poisonous to Dogs?,https://www.petmd.com/dog/poisons/-is-a-christmas-cactus-poisonous-to-dogs
Why Do Dogs Growl & What To Do,https://www.petmd.com/dog/behavior/why-do-dogs-growl
How to Keep Your Pet Calm During Social Gatherings,https://www.petmd.com/dog/behavior/how-to-keep-pets-safe-during-holiday-gatherings
10 Things You Probably Shouldn't Do at the Vet's Office,https://www.petmd.com/dog/general-health/10-things-you-should-not-do-at-vet-office
Flowers and Plants That Are Safe for Dogs,https://www.petmd.com/dog/wellness/grow-fresh-air-plants-are-safe-cats-and-dogs
Top 14 Types of Doodle Dogs,https://www.petmd.com/dog/care/types-of-doodle-dogs
What’s the Best Kind of Dog Food for Weight Loss?,https://www.petmd.com/dog/nutrition/whats-best-kind-dog-food-weight-loss
Dog Gum Colors and What They Mean,https://www.petmd.com/dog/general-health/dog-gum-colors-and-what-they-mean
Cold Weather Safety Tips for Traveling With Your Pet,https://www.petmd.com/dog/seasonal/cold-weather-safety-tips-traveling-pet
Signs a Dog With Diabetes Is Dying,https://www.petmd.com/dog/care/signs-a-dog-with-diabetes-is-dying
How Can I Protect My Christmas Tree From My Dog?,https://www.petmd.com/dog/how-can-i-protect-my-christmas-tree-my-dog
7 Safety Tips for Your Puppy’s First Christmas,https://www.petmd.com/dog/seasonal/7-safety-tips-your-puppys-first-christmas
Tinsel Is the Holiday Safety Hazard Pet Parents Need to Know About,https://www.petmd.com/dog/emergency/common-emergencies/holiday-pet-safety-hazard-tinsel
What's the Cost for Euthanizing a Dog or Cat?,https://www.petmd.com/general-health/whats-cost-euthanizing-dog-or-cat
How To Protect Dog Paws in Winter,https://www.petmd.com/dog/care/how-to-protect-dog-paws-in-winter
How Do You Know When to Put a Dog Down?,https://www.petmd.com/dog/care/when-to-put-dog-down
Euthanizing Pets at Home: Cost and What to Expect,https://www.petmd.com/dog/care/euthanizing-pets-home-cost-what-expect
Frostbite in Dogs,https://www.petmd.com/dog/emergency/common-emergencies/e_dg_frostbite
7 Common Ailments in Senior Dogs,https://www.petmd.com/dog/slideshows/care/common-ailments-for-senior-dogs
8 Things Animal Shelters Want You to Know About Pit Bull Dogs,https://www.petmd.com/dog/pet-lover/8-things-animal-shelters-want-you-know-about-pit-bull-dogs
Breed-Specific Legislation Gives Pit Bulls a Bad Reputation,https://www.petmd.com/dog/pet-lover/breed-specific-legislation-gives-pit-bulls-bad-reputation-0
10 Things to Consider Before Bringing a New Pet Home,https://www.petmd.com/dog/care/evr_multi_10_things_consider_before_pet_adoption
"Why Your Dog Sometimes Forgets His Training, and What You Can Do About It",https://www.petmd.com/dog/training/why-your-dog-sometimes-forgets-his-training-and-what-you-can-do-about-it
How to Choose an Experienced Dog Breeder,https://www.petmd.com/dog/care/evr_dg_breeders
How to Choose an Experienced Dog Breeder,https://www.petmd.com/dog/care/evr_dg_breeders
Is Your Dog Keeping You Awake at Night?,https://www.petmd.com/dog/training/evr_dg_sleepless_nights
Are Anxiety Blankets Safe for Pets?,https://www.petmd.com/dog/general-health/are-anxiety-blankets-safe-pets
Does Saying Goodbye Help Prevent Dog Separation Anxiety?,https://www.petmd.com/dog/pet-lover/does-saying-goodbye-help-prevent-dog-separation-anxiety
Adopting a Pet with a History of Abuse: What You Should Know,https://www.petmd.com/dog/behavior/adopting-pet-history-abuse-what-you-should-know
12 Plants That Are Poisonous for Dogs and Cats,https://www.petmd.com/dog/infographic/12-plants-are-poisonous-dogs-and-cats
Pet Care Checklist for Responsible Pet Parents,https://www.petmd.com/dog/infographic/pet-care-checklist-responsible-pet-parents
Guide for Finding Dog Measurements for All Your Dog Supplies,https://www.petmd.com/dog/infographic/guide-finding-dog-measurements-all-your-dog-supplies
Pet Safety Hurricane Kit Checklist,https://www.petmd.com/dog/infographic/pet-safety-hurricane-kit-checklist
Dog Friendly U.S. National Parks,https://www.petmd.com/dog/infographic/dog-friendly-us-national-parks
How Often Do Pets Cause Trip-and-Fall Injuries?,https://www.petmd.com/dog/pet-lover/how-often-do-pets-cause-trip-and-fall-injuries
Is Dog Poop Bad for Your Yard?,https://www.petmd.com/dog/pet-lover/dog-poop-hazardous-your-yard
Is Dog Poop Bad for Your Yard?,https://www.petmd.com/dog/pet-lover/dog-poop-hazardous-your-yard
4 Ways Veterinary Science Has Advanced in the Past 10 Years,https://www.petmd.com/dog/pet-lover/4-ways-veterinary-science-has-advanced-past-10-years
Can Dogs Tell the Difference Between Dogs and Other Animals?,https://www.petmd.com/dog/pet-lover/can-dogs-tell-difference-between-dogs-and-other-animals
This Nonprofit Helps Pit Bull Dogs and the People Who Love Them,https://www.petmd.com/dog/pet-lover/nonprofit-helps-pit-bull-dogs-and-people-who-love-them
You’re Not a Bad Pet Parent If Your Dog Doesn’t Like Kids,https://www.petmd.com/dog/pet-lover/youre-not-bad-pet-parent-if-your-dog-doesnt-kids
Dog Beds for Pets Who Travel With Their People,https://www.petmd.com/dog/pet-lover/dog-beds-pets-who-travel-their-people
How Often Do Pets Cause Trip-and-Fall Injuries?,https://www.petmd.com/dog/pet-lover/how-often-do-pets-cause-trip-and-fall-injuries
Dog Beds for Pets Who Travel With Their People,https://www.petmd.com/dog/pet-lover/dog-beds-pets-who-travel-their-people
How Much of a Dog’s Personality Comes From Their Owner?,https://www.petmd.com/dog/pet-lover/how-much-dogs-personality-comes-their-owner
Green Cleaning Products That Are Safe for Pets,https://www.petmd.com/dog/pet-lover/green-cleaning-products-are-safe-pets
Do You Know Proper Etiquette for Service Dogs?,https://www.petmd.com/dog/pet-lover/do-you-know-proper-etiquette-service-dogs
Pet Disaster Preparedness: Tips for Finding Pet-Friendly Evacuation Shelters,https://www.petmd.com/dog/pet-lover/pet-disaster-preparedness-tips-finding-pet-friendly-evacuation-shelters
Pet Disaster Preparedness: Tips for Finding Pet-Friendly Evacuation Shelters,https://www.petmd.com/dog/pet-lover/pet-disaster-preparedness-tips-finding-pet-friendly-evacuation-shelters
