post_name,Url
Winter Walking Dangers for Cats and Dogs,https://www.petmd.com/dog/seasonal/evr_winter_walking_dangers
Winter Weight Gain - You and Your Pet,https://www.petmd.com/dog/seasonal/evr_dg_winter_weight_gain
6 Vet-Approved Gifts for Pets That Will Keep Them Healthy,https://www.petmd.com/dog/seasonal/evr_multi_holiday_gifts_for_pets
Can Dogs Get Sunburned?,https://www.petmd.com/dog/seasonal/can-dogs-wear-sunscreen
Presidential Pets,https://www.petmd.com/dog/seasonal/evr_multi_presidential_pets
Dogs and Gunpowder: Knowing the Dangers,https://www.petmd.com/dog/seasonal/dogs-and-gunpowder-knowing-dangers
How to Alleviate Arthritic Pain During the Winter,https://www.petmd.com/dog/seasonal/evr_dg_winter_care_arthritis
Losing Weight While Exercising with Your Dog,https://www.petmd.com/dog/care/evr_multi_exercising_with_your_pet
What is a Veterinary Technician?,https://www.petmd.com/dog/care/evr_multi_what_is_a_veterinary_technician
How Do Dogs Try To Communicate?,https://www.petmd.com/dog/care/evr_dg_how_do_dogs_try_to_communicate
Pesky Summertime Pests,https://www.petmd.com/dog/care/evr_multi_summer_diseases
Boarding Your Dog (and Cat),https://www.petmd.com/dog/care/evr_dg_boarding_your_dog
The Price of the Spay (or Neuter) Procedure,https://www.petmd.com/dog/care/evr_dg_price_of_spay_or_neuter
Tips for Traveling with a Small Animal,https://www.petmd.com/dog/care/evr_multi_small_animal_travel
"Veterinary Specialists: Who Are They, Really",https://www.petmd.com/dog/care/evr_dg_veterinary_specialists_who_are_they_really
Vaccinating Your Own Dog: What You Should Know,https://www.petmd.com/dog/care/evr_vaccinating_your_own_dog
Summer Safety Tips for Your Dog,https://www.petmd.com/dog/care/evr_dg_summer_safety
Introducing Babies to Pets,https://www.petmd.com/dog/care/evr_multi_introducing_babies_to_pets
If Pets Could Talk: A Heartwarming Letter from Dog to Friend,https://www.petmd.com/dog/care/evr_dg_if_pets_could_talk
7 Tips For Caring For Your Pet This Winter,https://www.petmd.com/dog/care/evr_multi_caring_for_pets_during_winter
"Thank You, Annie ... A Letter from an Old Furry Friend",https://www.petmd.com/dog/care/evr_dg_letter_from_annie
A Clean Bill of Health,https://www.petmd.com/dog/care/evr_dg_clean_bill_of_health
Animal Hospital Pharmacy: Understanding What's in Your Pet's Medicine,https://www.petmd.com/dog/care/evr_dg_animal_hospital_pharmacy_understanding_whats_in_your_pets_medicine
Motherly Love 2.0,https://www.petmd.com/dog/care/evr_multi_maternal_instinct
Problems Common to Purebred Dogs,https://www.petmd.com/dog/care/evr_dg_purebred_dogs_complications
Determining the Best Age at Which to Spay or Neuter a Dog,https://www.petmd.com/dog/care/evr_determining_best_age_to_spay_or_neuter
How to Become a Veterinarian,https://www.petmd.com/dog/care/evr_multi_how_to_become_a_veterinarian
Elective Surgery: Should You Or Shouldn’t You?,https://www.petmd.com/dog/care/evr_dg_elective_surgery_should_I_or_shouldnt_I
What To Do When You Find a Stray Dog,https://www.petmd.com/dog/care/what-do-when-you-find-stray-dog
Shoo-Fly: How to Keep Flies Off Dogs,https://www.petmd.com/dog/care/evr_dg_how-to-keep-flies-off-dogs
Dog Health: What Tests Your Vet Should Run and When,https://www.petmd.com/dog/care/veterinary-tests-for-dogs
How Air Fresheners Can Affect Your Pet's Health,https://www.petmd.com/dog/care/air-fresheners-and-pets
Estate Planning for Pets: Why You Should Do It,https://www.petmd.com/dog/care/estate-planning-pets-why-you-should-do-it
"Giving Your Dog Meds While Pregnant, Lactating: What's Safe and Unsafe",https://www.petmd.com/dog/care/how-to-give-dogs-medications-while-pregnant-lactating
The Invisible Guard: How Many Americans are Deciding to Go with Underground Dog Fencing,https://www.petmd.com/dog/care/evr_dg_invisible_guard_underground_dog_fencing
Top 10 Pet Travel Tips,https://www.petmd.com/dog/care/evr_multi_top10_pet_travel_tips
7 Ways to Unwittingly Break a Dog's Spirit,https://www.petmd.com/dog/care/7-ways-unwittingly-break-dogs-spirit
Spaying and Neutering Dogs 101: Everything You Need to Know,https://www.petmd.com/dog/care/spay-and-neutering-dogs-101-everything-you-need-know
7 Ways Cold Weather Can Affect Your Dog,https://www.petmd.com/dog/care/7-ways-cold-weather-can-affect-your-dog
Benefits of In-Home Pet Boarding,https://www.petmd.com/dog/care/evr_multi_in-home_pet_boarding_benefits
5 Tips for Preventing Ear Infections in Dogs,https://www.petmd.com/dog/care/5-tips-preventing-ear-infections-dogs
Natural Disaster Planning for Pets,https://www.petmd.com/dog/care/evr_multi_disaster_planning_for_pets
Insider Tips For Pet-Friendly Road Travel,https://www.petmd.com/dog/care/insider-tips-pet-friendly-road-travel
10 Questions Everyone Should Ask Their Veterinarian,https://www.petmd.com/dog/care/10-questions-everyone-should-ask-their-veterinarian
3 Must-Know Dog Commands for Visiting Family,https://www.petmd.com/dog/care/3-must-know-dog-commands-visiting-family
Camping with Your Dog? Read These Vet-Approved Tips,https://www.petmd.com/dog/care/camping-with-your-dog-vet-tips
Setting the Record Straight on Spay and Neuter Myths,https://www.petmd.com/dog/care/setting-record-straight-spay-and-neuter-myths
Dog Adoption Fees Explained,https://www.petmd.com/dog/care/evr_dg_dog_adoption_fees_explained
Deaf Dogs Rock,https://www.petmd.com/dog/care/evr_dg_deaf_dogs_rock
How to Care for Your Dog's Cracked and Dry Paws,https://www.petmd.com/dog/care/how-care-your-dogs-cracked-and-dry-paws
What people foods are harmful to my pet?,https://www.petmd.com/dog/care/what-people-foods-are-harmful-my-pet
Is It Safe to Sleep with Your Pet?,https://www.petmd.com/dog/care/is-it-safe-to-sleep-with-pets
Eye Protection for Dogs: Is It Necessary?,https://www.petmd.com/dog/care/eye-protection-dogs-it-necessary
Planning for the Health of Your (New) Pet,https://www.petmd.com/dog/care/planning-for-the-health-of-your-pet
Mobile Vet Clinics: What Are They?,https://www.petmd.com/dog/care/mobile-vet-clinics-what-are-they
How to Examine Your Dog at Home (and When to See a Vet),https://www.petmd.com/dog/care/how-examine-your-dog-home-and-when-see-vet
Can Dogs Teach Kids Responsibility?,https://www.petmd.com/dog/care/can-dogs-teach-kids-responsibility
"Oral Medication for Dogs: What's the Difference Between Tablets, Chews, Liquids and Suspensions",https://www.petmd.com/dog/care/oral-medication-for-dogs-whats-the-difference
How to Get Children to Participate in Pet Care,https://www.petmd.com/dog/care/how-to-get-children-to-participate-in-pet-care
Alternatives to the Cone of Shame,https://www.petmd.com/dog/care/alternatives-cone-shame
Pet Travel,https://www.petmd.com/dog/care/evr_multi_pet_travel
Minimizing Dust-Bunnies: 9 Ways to Prevent Your Home from Becoming a Furball Haven,https://www.petmd.com/dog/care/minimizing-dust-bunnies-9-ways-prevent-your-home-becoming-furball-haven
Top 5 Boarding Options for Your Pet,https://www.petmd.com/dog/care/evr_multi_top_pet_boarding_options
6 Ways for You and Your Pet to Give Back,https://www.petmd.com/dog/care/10-ways-you-and-your-pet-give-back
The Scoop on Poop: Facts on How to Dispose of Dog Poop,https://www.petmd.com/dog/care/scoop-poop-facts-and-fiction-about-disposing-it
True and False About Pet Friendly Travel,https://www.petmd.com/dog/care/true_and_false_about_pet_friendly_travel
Prepare Your Pet for Car Trips,https://www.petmd.com/dog/care/prepare-your-pet-car-trips
Defining Senior Age in Dogs,https://www.petmd.com/dog/care/evr_dg_defining_senior_age_in_dogs
How to Help Older Family Members Keep Their Pets,https://www.petmd.com/dog/care/how-help-older-family-members-keep-their-pets
When is the best time to give my pet their medication?,https://www.petmd.com/dog/care/when-best-time-give-my-pet-their-medication
Smelly Pets and Seven Ways to Deal with Them,https://www.petmd.com/dog/care/evr_dg_smelly_pets_and_seven_ways_to_deal_with_them
The Guide to Washing a Dog Bed,https://www.petmd.com/dog/care/evr_dg_guide-to-washing-dog-bed
DIY Tips for Grooming a Dog at Home,https://www.petmd.com/dog/care/evr_dg_diy-tips-for-grooming-dog-at-home
Puppy Checklist: Getting off to a Great Start,https://www.petmd.com/dog/care/evr_dg_new_puppy_supplies_puppy_checklist
Your Puppy: Months 6-9,https://www.petmd.com/dog/care/your-puppy-months-6-9
How to Get Rid of Dog Smell Without Removing the Dog,https://www.petmd.com/dog/care/evr_dg_how_to_remove_the_smell_of_dog_without_removing_the_dog
Dog Braces: Everything You Need to Know,https://www.petmd.com/dog/care/dog-braces-everything-you-need-know
The Truth About Pet-Friendly Hotels,https://www.petmd.com/dog/care/the_truth_about_pet_friendly_hotels
Coping With Your Pet's Death: An Important Guide,https://www.petmd.com/dog/care/coping-your-pets-death-important-guide
Traveling by Air With Your Dog,https://www.petmd.com/dog/care/traveling-air-your-dog
What You Need to Know About Contact Voltage to Keep Your Pets Safe,https://www.petmd.com/dog/care/evr_multi_keeping_pets_safe_from_contage_voltage
Tips for Vacuuming Pet Hair,https://www.petmd.com/dog/care/tips-vacuuming-pet-hair
4 Heat-Related Risks in Pets You Should Watch Out For,https://www.petmd.com/dog/care/4-heat-related-risks-pets-you-should-watch-out
What to Do if Your Pet Gets Sick or Injured on Vacation,https://www.petmd.com/dog/care/what-do-if-your-pet-gets-sick-or-injured-vacation
Can I crush medication in my dog's food?,https://www.petmd.com/dog/care/can-i-crush-medication-my-dogs-food
Pedialyte for Dogs: Is It Safe?,https://www.petmd.com/dog/care/pedialyte-dogs-it-safe
Walking Your Dog vs. Just Letting Your Dog Out in the Backyard,https://www.petmd.com/dog/care/walking-your-dog-vs-just-letting-your-dog-out-backyard
Pets and Newborns: Myths You Shouldn’t Believe,https://www.petmd.com/dog/care/pets-and-newborns-myths-you-shouldnt-believe
Does My Dog Need a Dog House?,https://www.petmd.com/dog/care/does-my-dog-need-dog-house-0
How to Check for Dog Ear Problems,https://www.petmd.com/dog/care/how-check-dog-ear-problems
Are You Ready to Care for Foster Animals?,https://www.petmd.com/dog/care/are-you-ready-care-foster-animals
10 Pet Safety Tips For When Your Dog is Home Alone,https://www.petmd.com/dog/care/10-pet-safety-tips-when-your-dog-home-alone
How to Properly Pick Up a Puppy or Kitten,https://www.petmd.com/dog/care/how-properly-pick-puppy-or-kitten
Does My Dog Need a Rabies Vaccine Every Year?,https://www.petmd.com/dog/care/does-my-dog-need-rabies-vaccine-every-year
"How Many Teeth Do Dogs Have, and Can They Lose Them?",https://www.petmd.com/dog/care/how-many-teeth-do-dogs-have-and-can-they-lose-them
Pet Safety Tips for Public Events,https://www.petmd.com/dog/care/pet-safety-tips-public-events
Surprising Dog Harness Dangers to Avoid,https://www.petmd.com/dog/care/surprising-dog-harness-dangers-avoid
What to Expect When You Adopt a Blind Dog,https://www.petmd.com/dog/care/what-expect-when-you-adopt-blind-dog
Top 5 Ways to Fight Fleas and Ticks,https://www.petmd.com/dog/care/top-5-ways-fight-fleas-and-ticks
7 Ways to Ease Dog Arthritis in Cooler Weather,https://www.petmd.com/dog/care/7-ways-ease-dog-arthritis-cooler-weather
4 Health Care Considerations for Flat-Faced Dogs,https://www.petmd.com/dog/care/4-health-care-considerations-flat-faced-dogs
What is Normal Earwax for Pets?,https://www.petmd.com/dog/care/what-normal-earwax-pets
5 Surprising Senior Dog Care Tips,https://www.petmd.com/dog/care/5-surprising-senior-dog-care-tips
Hydrotherapy for Dogs,https://www.petmd.com/dog/care/hydrotherapy-dogs
Can You Give a Dog Ibuprofen?,https://www.petmd.com/dog/care/can-you-give-dog-ibuprofen
Rainbow Bridge Poem for Grieving a Pet,https://www.petmd.com/dog/care/rainbow-bridge-poem-grieving-pet
How Do No-Pull Dog Harnesses Work?,https://www.petmd.com/dog/care/how-do-no-pull-dog-harnesses-work
10 Reasons Why Your Pet Might Need a Rectal Exam,https://www.petmd.com/dog/care/10-reasons-why-your-pet-might-need-rectal-exam
3 Reasons to Microchip Your Dog Today,https://www.petmd.com/dog/care/3-reasons-microchip-your-dog-today
Your Dog Etiquette Checklist for Having Dogs at Work,https://www.petmd.com/dog/care/your-dog-etiquette-checklist-having-dogs-work
How an MRI Can Help Your Dog,https://www.petmd.com/dog/care/how-mri-can-help-your-dog
Why Flat-Faced Breeds Need Dog Harnesses Instead of Collars,https://www.petmd.com/dog/care/why-flat-faced-breeds-need-dog-harnesses-instead-collars
Do You Need a Dog Ramp?,https://www.petmd.com/dog/care/do-you-need-dog-ramp
Foxtail Plants: How to Find Them on Dogs and Why They're So Dangerous,https://www.petmd.com/dog/care/how-protect-your-dog-foxtails
Laser Therapy for Dogs,https://www.petmd.com/dog/care/laser-therapy-dogs
Get the Best Dog Harness for Your Dog’s Body Type,https://www.petmd.com/dog/care/get-best-dog-harness-your-dogs-body-type
How to Get Rid of Dog Pee Smell,https://www.petmd.com/dog/care/evr_dg_tips-for-removing-dog-urine-smell-from-carpet
What Is the DHPP Vaccine (5-in-1 Vaccine) for Dogs?,https://www.petmd.com/dog/care/what-5-1-vaccine-dogs
Is Dog Litter a Thing?,https://www.petmd.com/dog/care/dog-litter-thing
How to Give a Dog a Pill Using Foods That Are Safe,https://www.petmd.com/dog/care/how-give-dog-pill-using-foods-are-safe
Must-Haves for Hiring a Pet Sitter,https://www.petmd.com/dog/care/must-haves-hiring-pet-sitter-0
Dog Breeds Prone to Ear Infections,https://www.petmd.com/dog/care/dog-breeds-prone-ear-infections
Laparoscopic Spay for Dogs and Cats,https://www.petmd.com/dog/care/laparoscopic-spay-dogs-and-cats
Is Nasal Spray Safe for Dogs?,https://www.petmd.com/dog/care/nasal-spray-safe-dogs
How Safe Are Secondhand Used Pet Supplies?,https://www.petmd.com/dog/care/how-safe-are-secondhand-used-pet-supplies
Can Small Dogs Be Picked Up By Hawks and Birds of Prey?,https://www.petmd.com/dog/care/can-small-dogs-be-picked-hawks-and-birds-prey
Dog Car Seats and Seat Belts: Can They Keep Your Pup Safe?,https://www.petmd.com/dog/care/dog-car-seats-and-seat-belts-can-they-keep-your-pup-safe
How to Protect Your Pet from Coyotes,https://www.petmd.com/dog/care/how-protect-your-pet-coyotes
Natural Ways to Calm a Nervous Dog,https://www.petmd.com/dog/care/natural-ways-calm-nervous-dog-0
Is Exercise Safe for Pets with Cancer?,https://www.petmd.com/dog/care/exercise-safe-pets-cancer
At What Age Do Dogs Stop Growing?,https://www.petmd.com/dog/care/what-age-do-dogs-stop-growing
5 Ways Collars Can Harm Your Dog,https://www.petmd.com/dog/care/5-ways-collars-can-harm-your-dog
8 Ways to Shake Up Your Dog Walking Routine,https://www.petmd.com/dog/care/8-ways-shake-your-dog-walking-routine
5 Stair Safety Tips for Dogs,https://www.petmd.com/dog/care/5-stair-safety-tips-dogs
8 Risks of Treating Your Pet at Home,https://www.petmd.com/dog/care/8-risks-treating-your-pet-home
Gun Safety and Pets,https://www.petmd.com/dog/care/gun-safety-and-pets
How to Calculate Your Dog’s Healthy Weight,https://www.petmd.com/dog/care/how-calculate-your-dogs-healthy-weight
How to Choose the Right Dog Car Seat Cover,https://www.petmd.com/dog/care/how-choose-right-dog-car-seat-cover-0
Summer Animal Safety Tips for Beating the Heat,https://www.petmd.com/dog/care/summer-animal-safety-tips-beating-heat
7 Mistakes That Could Cause Weight Gain in Dogs and Cats,https://www.petmd.com/dog/care/7-mistakes-could-cause-weight-gain-dogs-and-cats
The Caregiver Burden in Pet Parents With Chronically Sick Dogs and Cats,https://www.petmd.com/dog/caregiver-burden-pet-parents-chronically-sick-dogs-and-cats
Can You Give a Dog Tylenol?,https://www.petmd.com/dog/care/can-you-give-dog-tylenol
Pet Safety Tips for Pet-Proofing Your Home,https://www.petmd.com/dog/care/pet-safety-tips-pet-proofing-your-home
The Effect Back to School Has on Family Dogs,https://www.petmd.com/dog/care/effect-back-school-has-family-dogs
"Why Do Dogs Lick Your Face, and Is It a Problem?",https://www.petmd.com/news/view/why-do-dogs-lick-your-face-and-it-problem-37799
How Confidence-Building Exercises Can Help Timid Dogs,https://www.petmd.com/news/view/how-confidence-building-exercises-can-help-timid-dogs-38096
Why Are Some Dogs More Aggressive?,https://www.petmd.com/news/view/why-are-some-dogs-more-aggressive-36736
How to Relieve Dog Travel Anxiety,https://www.petmd.com/news/view/how-relieve-pet-travel-anxiety-37157
Why Do Dogs Bring You Their Toys to Greet You?,https://www.petmd.com/news/view/why-do-dogs-bring-you-their-toys-greet-you-38092
Why Does My Cat Stare at Me?,https://www.petmd.com/news/view/why-does-my-cat-stare-me-38021
Canine Influenza Vaccination: Does Your Dog Need It?,https://www.petmd.com/news/view/canine-influenza-vaccination-does-your-dog-need-it-35403
Can Dogs Have Dog Best Friends?,https://www.petmd.com/news/view/can-dogs-have-dog-best-friends-37116
Dog Socialization: What to Do When Your Dog Won’t Socialize With Other Dogs,https://www.petmd.com/news/view/dog-socialization-what-do-when-your-dog-wont-socialize-other-dogs-37723
Is It Normal to Talk to Pets?,https://www.petmd.com/news/view/it-normal-talk-pets-35897
Pet Death: Why Missing Your Dog Is Normal,https://www.petmd.com/news/view/pet-death-why-missing-your-dog-normal-37064
Nervous Dog? Your Behavior Might Be the Cause,https://www.petmd.com/news/view/nervous-dog-your-behavior-might-be-cause-35604
How Social Media Is Helping More Pets Get Adopted,https://www.petmd.com/news/view/how-social-media-helping-more-pets-get-adopted-36490
Why Losing a Dog Can Be Harder Than Losing a Relative,https://www.petmd.com/news/view/why-losing-dog-can-be-harder-losing-relative-35932
Safety Tips for Using Heartworm Preventive Medications on Dogs,https://www.petmd.com/dog/parasites/evr_dg_safety_tips_heartworm_treatment_in_dogs
Why Heartworm Prevention Is More Important Than You Think,https://www.petmd.com/dog/parasites/evr_dg_how_dog_heartworm_treatment_preventive_medications_work
Types of Heartworm Preventive Treatment Products,https://www.petmd.com/dog/parasites/evr_dg_types_of_heartworm_preventive_products
Ant Bites on Dogs: How to Identify and Treat,https://www.petmd.com/dog/parasites/how-identify-and-treat-ant-bites-dogs
8-Legged Pests That Affect Your Pet,https://www.petmd.com/dog/parasites/ticks-on-dogs-cats-and-other-8-legged-pests
Is Toilet Water Safe for Pets to Drink?,https://www.petmd.com/cat/general-health/toilet-water-safe-pets-drink
Caring for an Emaciated Dog,https://www.petmd.com/dog/nutrition/evr_dg_care_of_the_emaciated_dog
Weight Reducing Diets For Dogs (and Cats),https://www.petmd.com/dog/nutrition/evr_dg_weight_reducing_diets
7 Medical Causes Behind Weight Gain,https://www.petmd.com/dog/nutrition/evr_multi_medical_causes_behind_weight_gain
How Do You Know Your Pet is Obese?,https://www.petmd.com/dog/nutrition/evr_multi_pet_obesity
What’s the Best Dog Food for Weight Gain?,https://www.petmd.com/dog/nutrition/whats-best-dog-food-weight-gain
Why Do Dogs Hump?,https://www.petmd.com/dog/behavior/why-do-dogs-hump
Do Dogs Have a Sixth Sense That Helps Them Read Your Mood?,https://www.petmd.com/dog/behavior/do-dogs-have-sixth-sense-helps-them-read-your-mood
Why Do Dogs Yawn?,https://www.petmd.com/dog/behavior/why-do-dogs-yawn
How to Desensitize Your Pet to the Vet,https://www.petmd.com/dog/behavior/how-desensitize-your-pet-vet
Timid Behaviors in Dogs: Are They Normal?,https://www.petmd.com/dog/behavior/timid-behaviors-dogs-are-they-normal
How to Stop Your Dog From Pulling on the Leash,https://www.petmd.com/dog/behavior/how-stop-your-dog-pulling-leash
Dog Brain Facts: Understanding Canine Cognition,https://www.petmd.com/dog/behavior/dog-brain-facts-understanding-canine-cognition
5 Ways to Relieve Your Dog’s Boredom,https://www.petmd.com/dog/behavior/5-ways-relieve-your-dogs-boredom
Do Dogs and Cats Have Long-Term Memories?,https://www.petmd.com/dog/behavior/do-dogs-and-cats-have-long-term-memories
Why Do Dogs Bark?,https://www.petmd.com/dog/behavior/why-do-dogs-bark
How to Calm a High Energy Dog,https://www.petmd.com/dog/behavior/how-calm-high-energy-dog
8 Dog Nose Facts You Probably Didn’t Know,https://www.petmd.com/dog/behavior/5-dog-nose-facts-you-probably-didnt-know
The Power of Praise: Encouraging Good Behavior in Dogs,https://www.petmd.com/dog/behavior/power-praise-encouraging-good-behavior-dogs
Why Do Dogs Lick The Air?,https://www.petmd.com/dog/behavior/why-do-dogs-lick-air
Pet Myths: Are Dogs Really Man's Best Friend?,https://www.petmd.com/dog/behavior/pet-myths-are-dogs-really-mans-best-friend
Can Dogs Have Obsessive Compulsive Disorders?,https://www.petmd.com/dog/behavior/evr_dog_behavior_compulsive_disorder
Why Does My Dog Lick My Wounds?,https://www.petmd.com/dog/behavior/why-does-my-dog-lick-my-wounds
Can Dogs Have Bipolar Disorder?,https://www.petmd.com/dog/behavior/can-dogs-have-bipolar-disorder
How to Heal an Emotionally Traumatized Pet,https://www.petmd.com/dog/behavior/how-heal-emotionally-traumatized-pet
Why Do Dogs Shred Paper Products?,https://www.petmd.com/dog/behavior/why-do-dogs-shred-paper-products
What to Do About a Dog That Bullies Other Dogs,https://www.petmd.com/dog/behavior/what-do-about-dog-bullies-other-dogs
Do You Need to Hire a Dog Behaviorist?,https://www.petmd.com/dog/behavior/do-you-need-hire-dog-behaviorist
Why Do Dogs Sit on Your Feet?,https://www.petmd.com/dog/behavior/why-do-dogs-sit-your-feet
Why Do Dogs Roll in Poop?,https://www.petmd.com/dog/behavior/why-do-dogs-roll-poop
Can Dogs Feel Embarrassed?,https://www.petmd.com/dog/behavior/can-dogs-feel-embarrassed
9 Signs Your Pet Is Jealous (and How to Stop It),https://www.petmd.com/dog/behavior/9-signs-your-pet-jealous-and-how-stop-it
How to Prevent Your Dog from Begging,https://www.petmd.com/dog/behavior/how-prevent-your-dog-begging
12 Dog Peeing Positions and What They Mean,https://www.petmd.com/dog/behavior/12-dog-peeing-positions-and-what-they-mean
Is My Dog Mad at Me?,https://www.petmd.com/dog/behavior/my-dog-mad-me
How Pet Parents Can Cope with Behavioral Problems in Pets,https://www.petmd.com/dog/behavior/how-pet-parents-can-cope-behavioral-problems-pets
"Dog Depression: Signs, Causes, and Treatment",https://www.petmd.com/dog/behavior/can-dogs-get-depressed
How to Stop a Dog From Barking,https://www.petmd.com/dog/behavior/evr_dg_how-to-stop-a-dog-from-barking
Why is My Dog Afraid to Go Outside?,https://www.petmd.com/dog/behavior/why-my-dog-afraid-go-outside
Why Do Dogs Eat Dirt?,https://www.petmd.com/dog/behavior/why-do-dogs-eat-dirt
Can Dogs Laugh?,https://www.petmd.com/dog/behavior/can-dogs-laugh
Why Do Dogs Roll in the Grass?,https://www.petmd.com/dog/behavior/why-do-dogs-roll-grass
How Do Dogs Find Their Way Home?,https://www.petmd.com/dog/behavior/how-do-dogs-find-their-way-home
Why Is My Dog Scared of Everything?,https://www.petmd.com/dog/behavior/why-my-dog-scared-everything
Aggression in Dogs Toward Familiar People,https://www.petmd.com/dog/conditions/behavioral/c_dg_aggression_toward_familiar
How to Handle Aggression Between Dogs (Inter-Dog Aggressive Behavior),https://www.petmd.com/dog/conditions/behavioral/c_dg_AggressionInterdog
Anxiety and Compulsive Disorders in Dogs,https://www.petmd.com/dog/conditions/behavioral/c_dg_compulsive_disorders
Maternal Behavior Problems in Female Dogs,https://www.petmd.com/dog/conditions/behavioral/c_dg_maternal_behavior_problems
"Jumping, Chewing, Playbiting, and Other Destructive Behavior Problems in Puppies, Young Dogs",https://www.petmd.com/dog/conditions/behavioral/c_dg_pediatric_behavior_problems
Can Dogs Have Panic Attacks?,https://www.petmd.com/dog/conditions/behavioral/can-dogs-have-panic-attacks
Why Do Dogs Like Squeaky Toys?,https://www.petmd.com/cat/behavior/why-do-dogs-squeaky-toys
