post_name,Url
Why Do Some Dogs Bark More Than Others?,https://www.petmd.com/dog/pet-lover/why-do-some-dogs-bark-more-others
What Type of Dog Carrier Do You Need?,https://www.petmd.com/dog/pet-lover/what-type-dog-carrier-do-you-need
5 Fun Activities to Do With Your Dog in the Backyard,https://www.petmd.com/dog/pet-lover/5-fun-activities-do-your-dog-backyard
You’re Not a Bad Pet Parent If Your Dog Doesn’t Like to Cuddle,https://www.petmd.com/dog/pet-lover/youre-not-bad-pet-parent-if-your-dog-doesnt-cuddle
Do You Know Proper Etiquette for Service Dogs?,https://www.petmd.com/dog/pet-lover/do-you-know-proper-etiquette-service-dogs
8 Dog Breeds for Cat People,https://www.petmd.com/dog/pet-lover/8-dog-breeds-cat-people
The Latest in Pet Tech,https://www.petmd.com/dog/pet-lover/latest-pet-tech-0
Can Dogs Smell Fear?,https://www.petmd.com/dog/pet-lover/can-dogs-smell-fear
How Often Do Pets Cause Trip-and-Fall Injuries?,https://www.petmd.com/dog/pet-lover/how-often-do-pets-cause-trip-and-fall-injuries
Can Dogs Empathize With Other Dogs' Emotions?,https://www.petmd.com/dog/pet-lover/can-dogs-empathize-other-dogs-emotions
Natural Ways to Improve Your Dog’s Immune System,https://www.petmd.com/dog/general-health/natural-ways-improve-your-dogs-immune-system
Paralyzed Dachshund Found in Trash Bag Finds Loving New Home,https://www.petmd.com/dog/general-health/paralyzed-dachshund-found-trash-bag-finds-loving-new-home
6 Exercises You Can Do With Your Dog,https://www.petmd.com/dog/general-health/6-exercises-you-can-do-your-dog
Dog Saliva: 9 Facts You Should Know,https://www.petmd.com/dog/general-health/dog-saliva-9-fast-facts-you-should-know
How Hydrotherapy and Swimming Can Benefit Dogs,https://www.petmd.com/dog/general-health/how-hydrotherapy-and-swimming-can-benefit-dogs
Is Vaping Dangerous for Pets?,https://www.petmd.com/dog/general-health/vaping-dangerous-pets
What Your Pet’s Urine Says About His Health,https://www.petmd.com/dog/general-health/what-your-pets-urine-says-about-their-health
Dog Saliva: 9 Facts You Should Know,https://www.petmd.com/dog/general-health/dog-saliva-9-fast-facts-you-should-know
How Hydrotherapy and Swimming Can Benefit Dogs,https://www.petmd.com/dog/general-health/how-hydrotherapy-and-swimming-can-benefit-dogs
What Your Pet’s Urine Says About His Health,https://www.petmd.com/dog/general-health/what-your-pets-urine-says-about-their-health
Poodle Trots with UK Top Dog Prize,https://www.petmd.com/dog/general-health/poodle-trots-uk-top-dog-prize
Paralyzed Dachshund Found in Trash Bag Finds Loving New Home,https://www.petmd.com/dog/general-health/paralyzed-dachshund-found-trash-bag-finds-loving-new-home
Growth in Dogs: What to Expect,https://www.petmd.com/dog/general-health/growth-dogs-what-expect
Chiggers on Dogs: What You Need to Know,https://www.petmd.com/dog/general-health/chiggers-dogs-what-you-need-know
Is Tap Water Safe for Dogs?,https://www.petmd.com/dog/general-health/tap-water-safe-dogs
7 Reasons To Thank Your Vet—and How to Do It,https://www.petmd.com/dog/general-health/7-reasons-thank-your-vet%E2%80%94and-how-do-it
Are Dogs Really Colorblind?,https://www.petmd.com/dog/general-health/are-dogs-really-colorblind
How to Weigh Your Dog at Home,https://www.petmd.com/dog/general-health/how-weigh-your-dog-home
Getting a Second Opinion: How to Do It Without Breaking the Bank (or Offending Your Vet),https://www.petmd.com/dog/general-health/getting-second-opinion-from-vet
Bladder Stones in Dogs: Can You Prevent Them?,https://www.petmd.com/dog/general-health/bladder-stones-dogs-can-you-prevent-them
Natural Ways to Improve Your Dog’s Immune System,https://www.petmd.com/dog/general-health/natural-ways-improve-your-dogs-immune-system
Importance of Purebred Research,https://www.petmd.com/dog/general-health/evr_dg_importance_of_purebred_research
Paw Pad Burns on Dogs: What to Do,https://www.petmd.com/dog/general-health/paw-pad-burns-dogs-what-do
Can Dogs and Puppies Get Hiccups?,https://www.petmd.com/dog/general-health/dog-hiccups-what-you-need-know
Can Dogs See in the Dark?,https://www.petmd.com/dog/general-health/can-dogs-see-dark
What Is a Fecal Transplant for Dogs and Cats?,https://www.petmd.com/dog/general-health/what-fecal-transplant-dogs-and-cats
5 Senior Pet Questions Answered by a Vet,https://www.petmd.com/dog/general-health/5-senior-pet-questions-answered-vet
How to Keep Giant Dog Breeds Healthy at Every Life Stage,https://www.petmd.com/dog/general-health/how-keep-giant-dog-breeds-healthy-every-life-stage
Do Dogs Have Taste Buds?,https://www.petmd.com/dog/general-health/do-dogs-have-taste-buds
Can Dogs See in the Dark?,https://www.petmd.com/dog/general-health/can-dogs-see-dark
Can Dogs and Puppies Get Hiccups?,https://www.petmd.com/dog/general-health/dog-hiccups-what-you-need-know
Should You Enroll Your Pet in a Clinical Trial?,https://www.petmd.com/dog/general-health/should-you-enroll-your-pet-clinical-trial
Can Dogs and Puppies Get Hiccups?,https://www.petmd.com/dog/general-health/dog-hiccups-what-you-need-know
"Caring for Three-Legged Dogs and Cats, aka “Tripawds”",https://www.petmd.com/dog/general-health/caring-three-legged-dogs-and-cats-aka-tripawds
Why Do Dogs Bark in Their Sleep?,https://www.petmd.com/dog/general-health/why-do-dogs-bark-their-sleep
Can Dogs See in the Dark?,https://www.petmd.com/dog/general-health/can-dogs-see-dark
Why Is My Dog’s Stomach Making Noises?,https://www.petmd.com/dog/general-health/dog-stomach-noises-what-do-they-mean
Which Over-the-Counter Human Medications Are Safe for Dogs?,https://www.petmd.com/dog/general-health/which-over-counter-human-medications-are-safe-dogs
Why Your Dog's Ears Smell and How to Clean Them,https://www.petmd.com/dog/general-health/why-do-my-dogs-ears-smell-bad
Balcony Safety and Pets: How to Avoid High-Rise Risks,https://www.petmd.com/dog/general-health/balcony-safety-and-pets-how-avoid-high-rise-risks
5 Senior Pet Questions Answered by a Vet,https://www.petmd.com/dog/general-health/5-senior-pet-questions-answered-vet
Can Dogs See in the Dark?,https://www.petmd.com/dog/general-health/can-dogs-see-dark
12 Dog Tongue Facts,https://www.petmd.com/dog/general-health/12-dog-tongue-facts
Should You Enroll Your Pet in a Clinical Trial?,https://www.petmd.com/dog/general-health/should-you-enroll-your-pet-clinical-trial
Can Dogs See in the Dark?,https://www.petmd.com/dog/general-health/can-dogs-see-dark
12 Dog Tongue Facts,https://www.petmd.com/dog/general-health/12-dog-tongue-facts
Can Dogs and Puppies Get Hiccups?,https://www.petmd.com/dog/general-health/dog-hiccups-what-you-need-know
Your Pet Health Questions Answered by Dr. Ben Carter,https://www.petmd.com/dog/general-health/your-pet-health-questions-answered-dr-ben-carter
"Caring for Three-Legged Dogs and Cats, aka “Tripawds”",https://www.petmd.com/dog/general-health/caring-three-legged-dogs-and-cats-aka-tripawds
Your Pet Health Questions Answered by Dr. Ben Carter,https://www.petmd.com/dog/general-health/your-pet-health-questions-answered-dr-ben-carter
5 Common Health Issues for Small Dogs,https://www.petmd.com/dog/slideshows/general-health/5-common-health-issues-small-dogs
5 Dangerous Bugs No Dog Owner Wants Brought Indoors,https://www.petmd.com/dog/slideshows/parasites/dangerous-bugs-no-dog-owner-wants-brought-indoors
Top Ten Health Benefits Walking Provides Your Pet,https://www.petmd.com/dog/slideshows/general_health/top-ten-health-benefits-walking-your-pet-provides
Top Three Cat-Like Dogs,https://www.petmd.com/dog/slideshows/care/top-three-cat-like-dog-breeds
How to Prepare for a Hurricane With Pets,https://www.petmd.com/dog/slideshows/emergency/pet-emergency-kit-items-natural-disasters
Top Ten Water Sports for Dogs,https://www.petmd.com/dog/slideshows/wellness/top-ten-canine-aquatic-sports
Top Ten Health Benefits Walking Provides Your Pet,https://www.petmd.com/dog/slideshows/general_health/top-ten-health-benefits-walking-your-pet-provides
How Your Dog's Behavior Can Change with Age,https://www.petmd.com/dog/slideshows/training/how-dog-behavior-changes-with-age
Five Common Methods of Pet ID,https://www.petmd.com/dog/slideshows/care/five-common-methods-of-pet-dog-ids
6 Ways to Get the Dog Ready for Your Baby,https://www.petmd.com/dog/slideshows/care/ways-to-get-dog-ready-for-your-baby
10 Toys for Senior Dogs,https://www.petmd.com/dog/slideshows/care/senior-dog-toys
Five Fun Facts About the St. Bernard,https://www.petmd.com/dog/slideshows/care/five-fun-facts-about-the-st-bernard
How to Prepare for a Hurricane With Pets,https://www.petmd.com/dog/slideshows/emergency/pet-emergency-kit-items-natural-disasters
Top Ten Water Sports for Dogs,https://www.petmd.com/dog/slideshows/wellness/top-ten-canine-aquatic-sports
6 Ways to Get the Dog Ready for Your Baby,https://www.petmd.com/dog/slideshows/care/ways-to-get-dog-ready-for-your-baby
Decoding Your Dog's Sleeping Habits,https://www.petmd.com/dog/slideshows/decoding-your-dogs-sleeping-habits
10 Toys for Senior Dogs,https://www.petmd.com/dog/slideshows/care/senior-dog-toys
5 Dangerous Bugs No Dog Owner Wants Brought Indoors,https://www.petmd.com/dog/slideshows/parasites/dangerous-bugs-no-dog-owner-wants-brought-indoors
6 Ways to Get the Dog Ready for Your Baby,https://www.petmd.com/dog/slideshows/care/ways-to-get-dog-ready-for-your-baby
Top Ten Health Benefits Walking Provides Your Pet,https://www.petmd.com/dog/slideshows/general_health/top-ten-health-benefits-walking-your-pet-provides
7 Tips to Keep Your Pet Cool this Summer,https://www.petmd.com/dog/slideshows/care/7-tips-keep-your-pet-cool-summer
Dog DNA Tests: The 6 Most Common Results for Mixed Breed Dogs,https://www.petmd.com/dog/slideshows/dog-dna-tests-6-most-common-results-mixed-breed-dogs
Top 10 Cleanest Dog Breeds,https://www.petmd.com/dog/slideshows/top-10-cleanest-dog-breeds
Top 10 Cleanest Dog Breeds,https://www.petmd.com/dog/slideshows/top-10-cleanest-dog-breeds
7 Types of Water That Can Make Your Dog Sick,https://www.petmd.com/dog/slideshows/7-types-water-can-make-your-dog-sick
5 Ways to Keep Your Dog Feeling Full,https://www.petmd.com/dog/slideshows/5-ways-keep-your-dog-feeling-full
6 Things You Should NEVER Do When Adopting a Dog,https://www.petmd.com/dog/slideshows/6-things-you-should-never-do-when-adopting-dog
20 Spring Dangers That Can Affect Your Pet,https://www.petmd.com/dog/slideshows/seasonal/20-spring-dangers-can-affect-your-pet
7 Ways to Comfort Your Dog While Flying,https://www.petmd.com/dog/slideshows/7-ways-comfort-your-dog-while-flying
12 Fascinating Facts You Didn’t Know About Newborn Puppies,https://www.petmd.com/dog/slideshows/12-fascinating-facts-you-didnt-know-about-newborn-puppies
5 Pet Safety Tips for Taking Your Dog to the Beach,https://www.petmd.com/dog/slideshows/5-pet-safety-tips-taking-your-dog-beach
"Mold Poisoning in Pets – Causes, Symptoms and Treatment",https://www.petmd.com/dog/slideshows/mold-poisoning-pets-causes-symptoms-and-treatment
7 Common Bath-Time Mistakes Pet Owners Make,https://www.petmd.com/dog/slideshows/7-common-bath-time-mistakes-pet-owners-make
6 Things You Should NEVER Do When Adopting a Dog,https://www.petmd.com/dog/slideshows/6-things-you-should-never-do-when-adopting-dog
7 Types of Water That Can Make Your Dog Sick,https://www.petmd.com/dog/slideshows/7-types-water-can-make-your-dog-sick
5 Cleaning Products That Could Harm Your Dog,https://www.petmd.com/dog/slideshows/5-cleaning-products-could-harm-your-dog
6 Things That Give Your Pet Gas,https://www.petmd.com/dog/slideshows/6-things-give-your-pet-gas
5 Ways to Strengthen Your Dog’s Bones,https://www.petmd.com/dog/slideshows/5-ways-strengthen-your-dogs-bones
6 Reasons Your Dog Smells Bad,https://www.petmd.com/dog/slideshows/6-reasons-your-dog-smells-bad
5 Trash Can Dangers for Your Pet,https://www.petmd.com/dog/slideshows/5-trash-can-dangers-your-pet
5 Anesthesia Risks for Pets You Should Know,https://www.petmd.com/dog/slideshows/general-health/5-anesthesia-risks-pets-you-should-know
6 Things Commonly Found in Your Dog’s Poop,https://www.petmd.com/dog/slideshows/6-things-commonly-found-your-dogs-poop
6 Ways to Help Your Old Dog Feel Young,https://www.petmd.com/dog/slideshows/6-ways-help-your-old-dog-feel-young
7 Ways to Clean Your Dog’s Paws ,https://www.petmd.com/dog/slideshows/7-ways-clean-your-dogs-paws
7 Ways to Comfort Your Dog While Flying,https://www.petmd.com/dog/slideshows/7-ways-comfort-your-dog-while-flying
6 Dog Grooming Secrets Your Groomer Wishes You Knew,https://www.petmd.com/dog/slideshows/grooming/6-dog-grooming-secrets-your-groomer-wishes-you-knew
5 Pet Safety Tips for Taking Your Dog to the Beach,https://www.petmd.com/dog/slideshows/5-pet-safety-tips-taking-your-dog-beach
5 Ways to Keep Your Dog Feeling Full,https://www.petmd.com/dog/slideshows/5-ways-keep-your-dog-feeling-full
8 Essential Tips for Picking Up Dog Poop,https://www.petmd.com/dog/slideshows/8-essential-tips-picking-dog-poop
6 Heartworm Prevention Mistakes You Might Be Making,https://www.petmd.com/dog/slideshows/parasites/6-heartworm-prevention-mistakes-you-might-be-making
Dog DNA Tests: The 6 Most Common Results for Mixed Breed Dogs,https://www.petmd.com/dog/slideshows/dog-dna-tests-6-most-common-results-mixed-breed-dogs
Top 10 Cleanest Dog Breeds,https://www.petmd.com/dog/slideshows/top-10-cleanest-dog-breeds
8 Dog Exercising Tips for Warm Weather,https://www.petmd.com/dog/slideshows/8-dog-exercising-tips-warm-weather
6 Poisonous Mushrooms That Are Toxic to Dogs,https://www.petmd.com/dog/slideshows/6-poisonous-mushrooms-are-toxic-dogs
4 Scary Things Living in Your Dog's Bed,https://www.petmd.com/dog/slideshows/scary-things-in-dog-bed
8 Signs of a Bad Boarding Kennel,https://www.petmd.com/dog/slideshows/8-signs-bad-boarding-kennel
5 Common Back Problems in Dogs,https://www.petmd.com/dog/slideshows/5-common-back-problems-dogs
6 Pet Safety Tips for After a Hurricane Hits,https://www.petmd.com/dog/slideshows/6-pet-safety-tips-after-hurricane-hits
6 Common Puppy Actions and What They Mean,https://www.petmd.com/dog/slideshows/6-common-puppy-actions-and-what-they-mean
5 Trash Can Dangers for Your Pet,https://www.petmd.com/dog/slideshows/5-trash-can-dangers-your-pet
Training Tips to Strengthen Your Bond With Your Dog,https://www.petmd.com/dog/training/training-tips-strengthen-your-bond-your-dog
How to Introduce Dogs the Right Way,https://www.petmd.com/dog/training/evr_introducing_a_new_dog_to_a_resident_dog
How to Nip Problem Barking in the Bud,https://www.petmd.com/dog/puppycenter/training/evr_dg_how_to_nip_problem_barking_in_the_bud
Training Senior Dogs to Play Games on Touch Screens,https://www.petmd.com/dog/training/training-senior-dogs-play-games-touch-screens
"Dog-Tested, Trainer-Approved Dog Toys",https://www.petmd.com/dog/training/dog-tested-trainer-approved-dog-toys
You’re Not a Bad Pet Parent if Your Dog Hates Fetch,https://www.petmd.com/dog/training/youre-not-bad-pet-parent-if-your-dog-hates-fetch
Search and Rescue Dogs,https://www.petmd.com/dog/training/evr_dg_rescue_dog_training
4 Critical Dog Training Cues That Could Save Your Dog’s Life,https://www.petmd.com/dog/training/evr_dg_critical_commands_to_save_dogs_life
4 Hand Signals for Dogs That You Can Teach Your Pup,https://www.petmd.com/dog/training/4-hand-signals-dogs-you-can-teach-your-pup
Dog Shaping: You Can Use This Dog Training Method in Almost Any Situation,https://www.petmd.com/dog/training/dog-shaping-you-can-use-dog-training-method-almost-any-situation
"You Get More Flies, and Dogs, with Honey",https://www.petmd.com/blogs/purelypuppy/lradosta/2013/march/training-dogs-the-nice-way-29977
How to Teach a Dog to Stay Anywhere,https://www.petmd.com/dog/training/how-teach-dog-stay-anywhere
How to Properly Put on a Dog Harness,https://www.petmd.com/dog/training/evr_dg_how-to-properly-put-on-dog-harness
How to Prep Your 'Top Dog' Before Bringing a Puppy Home,https://www.petmd.com/dog/training/evr_dg_newpup_oldpup
The Do’s and Don’ts of Dogs in the Workplace,https://www.petmd.com/dog/training/dos-and-donts-dogs-workplace
How NOT to Bore Your Pet,https://www.petmd.com/dog/training/evr_multi_bored_pets
When Barking is a Problem,https://www.petmd.com/dog/training/evr_dg_when_barking_is_a_problem
Tips for Keeping Your Dog Off the Furniture,https://www.petmd.com/dog/training/evr_dg_tips-for-keeping-dog-off-furniture
Reducing Pet Fear in the Veterinary Setting: One Veterinarian’s Experience,https://www.petmd.com/dog/training/evr_dg_reducing_pet_fear_in_the_veterinary_setting
Dog Walking Tips: What Not to Do When Walking Your Dog,https://www.petmd.com/dog/training/dog-walking-tips-what-not-do-when-walking-your-dog
Canine Positive Portable Kennel Training,https://www.petmd.com/dog/training/evr_dg_canine_positive_portable_kennel_training
"Why Your Dog Won’t Walk on the Leash, From Dog Training to Health Issues",https://www.petmd.com/dog/training/why-your-dog-wont-walk-leash-dog-training-health-issues
How to Teach a Dog to Lie Down,https://www.petmd.com/dog/training/how-teach-dog-lie-down
Service Dogs: How to Make Your Dog a Service Dog and More	,https://www.petmd.com/dog/training/evr_dg_service_dogs
How to Become a Dog Trainer,https://www.petmd.com/dog/training/evr_dg_professional_dog_training
How to Choose and Fit a No-Pull Dog Harness,https://www.petmd.com/dog/training/how-choose-and-fit-no-pull-dog-harness
How to Make a Dog Bark,https://www.petmd.com/dog/training/evr_dg_how-to-make-a-dog-bark
Dog Manners: Why It’s Important to Teach Your Dog to “Say Please”,https://www.petmd.com/dog/training/dog-manners-why-its-important-teach-your-dog-say-please
Proper Etiquette at the Dog Park,https://www.petmd.com/dog/training/evr_dg_proper_etiquette_at_the_dog_park
Why Are Dogs Scared of Vacuums?,https://www.petmd.com/dog/training/why-are-dogs-scared-vacuums
Essential Senior Dog Training Tools,https://www.petmd.com/dog/training/essential-senior-dog-training-tools
Out and About: Meeting and Greeting 'Strange' Dogs,https://www.petmd.com/dog/training/evr_dg_meeting_and_greeting_strange_dogs
Obedience Training for Dogs: 4 Easy Cues to Master,https://www.petmd.com/dog/training/obedience-training-dogs-4-easy-cues-master
5 Reasons Why Your Dog Runs Away When You Call,https://www.petmd.com/dog/training/5-reasons-why-your-dog-runs-away-when-you-call
How to Teach a Dog to Sit No Matter Where You Are,https://www.petmd.com/dog/training/how-teach-dog-sit-no-matter-where-you-are
You’re Not a Bad Pet Parent If Your Dog Jumps on People,https://www.petmd.com/dog/training/youre-not-bad-pet-parent-if-your-dog-jumps-people
Tips for Finding Your Pup's Million-Dollar Dog Training Treats,https://www.petmd.com/dog/training/tips-finding-your-pups-million-dollar-dog-training-treats
3 Dog Behaviors You Can Accidentally “Untrain”,https://www.petmd.com/dog/training/3-dog-behaviors-you-can-accidentally-untrain
These Dog Training Tips Can Help Your Pup Overcome Leash Reactivity,https://www.petmd.com/dog/training/these-dog-training-tips-can-help-your-pup-overcome-leash-reactivity
How to Teach a Dog to Come to You in Any Environment,https://www.petmd.com/dog/training/how-teach-dog-come-you-any-environment
How to Apply the Premack Principle to Dog Training,https://www.petmd.com/dog/training/how-apply-premack-principle-dog-training
How to Train a Deaf Dog,https://www.petmd.com/dog/training/how-train-deaf-dog
How to Become a Professional Pet Sitter/Dog Walker,https://www.petmd.com/dog/training/evr_dg_pet_sitter_dog_walker
You’re Not a Bad Pet Parent if Your Dog Hates the Dog Park or Dog Beach,https://www.petmd.com/dog/training/youre-not-bad-pet-parent-if-your-dog-hates-dog-park-or-dog-beach
What Are Vapor Wake Dogs?,https://www.petmd.com/dog/training/what-are-vapor-wake-dogs
5 Dog Training Rewards That Aren't Food,https://www.petmd.com/dog/training/5-dog-training-rewards-arent-food
Training the Next Generation of Search and Rescue Dogs,https://www.petmd.com/blogs/thedailyvet/patrick-mahaney/2014/september/training-next-generation-search-and-rescue-dogs-319
How to Teach Your Dog to Go to the Bathroom in the Snow or Rain,https://www.petmd.com/dog/training/how-teach-your-dog-go-bathroom-snow-or-rain
How to Teach Your Dog to Come When Called,https://www.petmd.com/dog/training/how-teach-your-dog-come-when-called
Dos and Don'ts of Recall Training,https://www.petmd.com/dog/training/evr_dg_dos_and_donts_of_recall_training
You’re Not a Bad Pet Parent if Your Dog is a Loner,https://www.petmd.com/dog/training/youre-not-bad-pet-parent-if-your-dog-loner
Why Invisible Fences Don’t Work,https://www.petmd.com/dog/training/why-invisible-fences-dont-work
How to Stop Your Dog From Jumping Up,https://www.petmd.com/dog/training/how-stop-your-dog-jumping
3 Simple Tips to Train Your Puppy,https://www.petmd.com/dog/puppycenter/training/evr_dg_DIY_puppy_obedience_training
How to Teach a Dog to Lie Down No Matter Where You Are,https://www.petmd.com/dog/training/how-teach-dog-lie-down-no-matter-where-you-are
Citizen Train: Certifying Your Dog as a Good Citizen,https://www.petmd.com/dog/training/evr_dg_canine_citizen
Keeping Dogs Fit in the Country,https://www.petmd.com/dog/wellness/evr_dg_keeping_pets_fit_in_the_country
Neem Oil for Pets: Is It Safe?,https://www.petmd.com/dog/wellness/neem-oil-pets-it-safe
The Post-Workout Cool Down for Your Dog,https://www.petmd.com/dog/wellness/evr_dg_post-workout_cooldown_for_your_dog
The Best Places to Pet Your Dog,https://www.petmd.com/dog/wellness/evr_dg_the-best-places-to-pet-your-dog
6 Ways to Go Natural With Your Pet,https://www.petmd.com/dog/wellness/6-ways-go-natural-your-pet
Pets and Your Love Life: What the Experts Say,https://www.petmd.com/dog/wellness/pets-and-your-love-life-what-experts-say
Dancing with Your Dog,https://www.petmd.com/dog/wellness/evr_dg_dancing_with_your_dog
Veterinary Rehabilitation Services for Dogs and Cats,https://www.petmd.com/dog/wellness/evr_multi_therapeutic_services_for_dogs
Doga: Yoga for Dogs,https://www.petmd.com/dog/wellness/evr_dg_doga
3 Alternative Veterinary Care Treatments to Consider,https://www.petmd.com/dog/wellness/evr_multi_alternative_veterinary_treatments
Staying Safe While Walking with Your Dog at Night,https://www.petmd.com/dog/wellness/evr_dg_staying_safe_while_walking_your_dog_at_night
Army Veterinarians: On a Mission to Keep Military Dogs Healthy,https://www.petmd.com/dog/wellness/army-veterinarians-mission-keep-military-dogs-healthy
How to Give Your Pet a Massage,https://www.petmd.com/dog/wellness/how-give-your-pet-massage
5 Signs Your Dog Is Getting Too Much Exercise,https://www.petmd.com/dog/wellness/5-signs-your-dog-getting-too-much-exercise
"You, Your Dog, and a Flying Disc",https://www.petmd.com/dog/wellness/evr_dg_your_dog_and_a_flying_disc
What is Dog Snow Nose and What Can You Do About it?,https://www.petmd.com/dog/wellness/what-dog-snow-nose-and-what-can-you-do-about-it
Mushing with Your Dog: The Basics,https://www.petmd.com/dog/wellness/evr_dg_mushing_with_your_dog-the_basics
Herb 'N' Living: Growing a Home Garden for Your Pet,https://www.petmd.com/dog/wellness/evr_multi_herb_n_living
BPA-Free and Nontoxic Dog Toys: What Do the Labels Mean?,https://www.petmd.com/dog/wellness/bpa-free-and-nontoxic-dog-toys-what-do-labels-mean
5 Health Benefits You Can Expect When You Help Your Dog Lose Weight,https://www.petmd.com/dog/wellness/5-health-benefits-you-can-expect-when-you-help-your-dog-lose-weight
Dog and Cat Vaccination FAQ,https://www.petmd.com/dog/wellness/dog-and-cat-vaccination-faq
Should Your Dog Join a Health Club?,https://www.petmd.com/dog/wellness/evr_dg_should_your_dog_joing_a_health_club
Prosthetics Get Quadruple Amputee Dog Back on His Feet,https://www.petmd.com/dog/wellness/prosthetics-get-quadruple-amputee-dog-back-his-feet
Skijoring: A Combination of Cross Country Skiing and Dog Sledding,https://www.petmd.com/dog/wellness/evr_dg_skijoring_a_combination_of_cross_country_skiing_and_dog_sledding
Tips for Safely Biking With Your Dog,https://www.petmd.com/dog/wellness/evr_dg_biking_with_your_dog_safely
Keeping Your Pet Fit in the City,https://www.petmd.com/dog/wellness/evr_dg_keeping_your_pet_fit_in_the_city
Lure Coursing: The Sport for Dogs that are Born to Chase,https://www.petmd.com/dog/wellness/evr_dg_lure_coursing-the_sport_for_dogs_that_are_born_to_chase
How to Use GPS Dog Tracking Collars to Help Your Pup Lose Weight,https://www.petmd.com/dog/wellness/how-use-gps-dog-tracking-collars-help-your-pup-lose-weight
8 Pet Care Tasks That Are Usually Overlooked,https://www.petmd.com/dog/wellness/8-pet-care-tasks-are-usually-overlooked
Exercising With Your Dog 101,https://www.petmd.com/dog/wellness/evr_dg_exercising_with_your_dog101
Does Reflexology Benefit Dogs?,https://www.petmd.com/dog/wellness/does-reflexology-benefit-dogs
Exercise for Your Senior Dog,https://www.petmd.com/dog/wellness/evr_dg_exercise_for_your_senior_dog
How Ordinary Folks Deal with Pet Allergies,https://www.petmd.com/dog/wellness/c_multi_pet_allergies_hi
Irish Dog Breeds for St. Patrick's Day,https://www.petmd.com/dog/seasonal/evr_dg_st_pattys_day
Are Christmas Pets a Good Idea?,https://www.petmd.com/dog/seasonal/evr_pets_for_christmas
Do Dogs Need Sweaters in Winter?,https://www.petmd.com/dog/seasonal/evr_dg_sweaters_for_dogs
"Keeping Fleas, Ticks, and Mosquitoes Away… Even in the Winter",https://www.petmd.com/dog/seasonal/evr_multi_flea_tick_mosquito_care_during_winter
Chlorine in Pools: Is it Safe for Pets?,https://www.petmd.com/dog/seasonal/chlorine-pools-it-safe-pets
Cold Weather Hazards: Rodenticides,https://www.petmd.com/dog/seasonal/evr_dg_rodenticides
To Give or Not to Give,https://www.petmd.com/dog/seasonal/evr_multi_pets_for_holiday
Grill Safety for Pets,https://www.petmd.com/dog/seasonal/grill-safety-pets
12 Holiday Gifts for Pets to Surprise Your Four-Legged Friends With,https://www.petmd.com/dog/seasonal/12-holiday-gifts-pets-surprise-your-four-legged-friends
